{"campaignId":"exact-boundary","compatibilityErrors":[],"metrics":[{"claimKind":"NON_REGRESSION","decision":"PASS","gate":"COLD_MEDIAN","interval":{"lower95":1.05,"pointEstimate":1.05,"upper95":1.05},"limit":1.05,"metric":"LATENCY","mode":"COLD","reason":"exact upper boundary passes","statistic":"MEDIAN"}],"overall":"PASS","rejectedBlocks":[],"schema":"revoman-benchmark-comparison/v1"}