{"campaignId":"campaign-fe7d7364-4dce-48a9-a23b-32c076fe424e","compatibilityErrors":[],"metrics":[{"claimKind":"NON_REGRESSION","decision":"PASS","gate":"WARM_MEDIAN","interval":{"lower95":0.997197331982389,"pointEstimate":1.0001588107582935,"upper95":1.0052968400696192},"limit":1.03,"metric":"LATENCY","mode":"WARM","reason":"upper95 1.0052968400696192 is at most 1.03","statistic":"MEDIAN"},{"claimKind":"NON_REGRESSION","decision":"PASS","gate":"WARM_P95","interval":{"lower95":0.9796704449806652,"pointEstimate":0.9985003826546492,"upper95":1.0135137001543748},"limit":1.05,"metric":"LATENCY","mode":"WARM","reason":"upper95 1.0135137001543748 is at most 1.05","statistic":"P95"},{"claimKind":"NON_REGRESSION","decision":"PASS","gate":"WARM_ALLOCATION","interval":{"lower95":0.9992281979843176,"pointEstimate":0.9998884517112505,"upper95":1.000546931609329},"limit":1.03,"metric":"ALLOCATED_BYTES","mode":"WARM","reason":"upper95 1.000546931609329 is at most 1.03","statistic":"MEAN"}],"overall":"PASS","rejectedBlocks":[],"schema":"revoman-benchmark-comparison/v1"}