{"campaignId":"campaign-d9a9068a-92a1-45e1-82c1-d81ccc54ab22","compatibilityErrors":[],"metrics":[{"claimKind":"NON_REGRESSION","decision":"INCONCLUSIVE","gate":"COLD_MEDIAN","interval":{"lower95":0.9795074571751775,"pointEstimate":1.0075728261686674,"upper95":1.035493431215144},"limit":1.05,"metric":"LATENCY","mode":"COLD","reason":"SMOKE evidence cannot satisfy release gates","statistic":"MEDIAN"},{"claimKind":"NON_REGRESSION","decision":"INCONCLUSIVE","gate":"COLD_P95","interval":{"lower95":0.9795074571751775,"pointEstimate":1.0327078531581637,"upper95":1.035493431215144},"limit":1.1,"metric":"LATENCY","mode":"COLD","reason":"SMOKE evidence cannot satisfy release gates","statistic":"P95"},{"claimKind":"NON_REGRESSION","decision":"INCONCLUSIVE","gate":"COLD_ALLOCATION","limit":1.05,"metric":"ALLOCATED_BYTES","mode":"COLD","reason":"SMOKE evidence cannot satisfy release gates","statistic":"MEAN"},{"claimKind":"NON_REGRESSION","decision":"INCONCLUSIVE","gate":"COLD_PEAK_RSS","limit":1.05,"metric":"PEAK_RSS","mode":"COLD","reason":"SMOKE evidence cannot satisfy release gates","statistic":"MEAN"}],"overall":"INCONCLUSIVE","rejectedBlocks":[],"schema":"revoman-benchmark-comparison/v1"}