{"campaignId":"campaign-1b96143b-d497-4778-aef9-5cb5557fac7c","compatibilityErrors":[],"metrics":[{"claimKind":"NON_REGRESSION","decision":"INCONCLUSIVE","gate":"WARM_MEDIAN","interval":{"lower95":0.7315253495484835,"pointEstimate":0.8376489914803986,"upper95":1.188410911445803},"limit":1.03,"metric":"LATENCY","mode":"WARM","reason":"SMOKE evidence cannot satisfy release gates","statistic":"MEDIAN"},{"claimKind":"NON_REGRESSION","decision":"INCONCLUSIVE","gate":"WARM_P95","interval":{"lower95":0.7774146198078415,"pointEstimate":1.0271819910963513,"upper95":1.1569554777377962},"limit":1.05,"metric":"LATENCY","mode":"WARM","reason":"SMOKE evidence cannot satisfy release gates","statistic":"P95"},{"claimKind":"NON_REGRESSION","decision":"INCONCLUSIVE","gate":"WARM_ALLOCATION","limit":1.03,"metric":"ALLOCATED_BYTES","mode":"WARM","reason":"SMOKE evidence cannot satisfy release gates","statistic":"MEAN"}],"overall":"INCONCLUSIVE","rejectedBlocks":[],"schema":"revoman-benchmark-comparison/v1"}