{"campaignId":"inconclusive","compatibilityErrors":[],"metrics":[{"claimKind":"NON_REGRESSION","decision":"INCONCLUSIVE","gate":"COLD_ALLOCATION","limit":1.05,"metric":"ALLOCATED_BYTES","mode":"COLD","reason":"allocation evidence is missing","statistic":"MEAN"}],"overall":"INCONCLUSIVE","rejectedBlocks":[],"schema":"revoman-benchmark-comparison/v1"}