{"campaignId":"campaign-dfdabddd-7d51-4ac7-b5fd-f69b093b87cf","compatibilityErrors":[],"metrics":[{"claimKind":"NON_REGRESSION","decision":"PASS","gate":"COLD_MEDIAN","interval":{"lower95":0.9885179360304267,"pointEstimate":0.9947485581249779,"upper95":0.9992411840788291},"limit":1.05,"metric":"LATENCY","mode":"COLD","reason":"upper95 0.9992411840788291 is at most 1.05","statistic":"MEDIAN"},{"claimKind":"NON_REGRESSION","decision":"PASS","gate":"COLD_P95","interval":{"lower95":0.9604404530662021,"pointEstimate":0.9837132997060669,"upper95":1.0258090377991314},"limit":1.1,"metric":"LATENCY","mode":"COLD","reason":"upper95 1.0258090377991314 is at most 1.1","statistic":"P95"},{"claimKind":"NON_REGRESSION","decision":"PASS","gate":"COLD_ALLOCATION","interval":{"lower95":0.9978442336183978,"pointEstimate":1.0008156817594287,"upper95":1.0038070041536087},"limit":1.05,"metric":"ALLOCATED_BYTES","mode":"COLD","reason":"upper95 1.0038070041536087 is at most 1.05","statistic":"MEAN"},{"claimKind":"NON_REGRESSION","decision":"PASS","gate":"COLD_PEAK_RSS","interval":{"lower95":0.9904807622380588,"pointEstimate":0.9996328171925666,"upper95":1.0087873573002464},"limit":1.05,"metric":"PEAK_RSS","mode":"COLD","reason":"upper95 1.0087873573002464 is at most 1.05","statistic":"MEAN"}],"overall":"PASS","rejectedBlocks":[{"blockId":38,"metric":"ALLOCATED_BYTES","reasons":["load-average-exceeds-maximum"],"workloadId":"lifecycle.no-script-one-step.v1"},{"blockId":39,"metric":"ALLOCATED_BYTES","reasons":["load-average-exceeds-maximum"],"workloadId":"lifecycle.no-script-one-step.v1"},{"blockId":40,"metric":"ALLOCATED_BYTES","reasons":["load-average-exceeds-maximum"],"workloadId":"lifecycle.no-script-one-step.v1"},{"blockId":41,"metric":"ALLOCATED_BYTES","reasons":["load-average-exceeds-maximum"],"workloadId":"lifecycle.no-script-one-step.v1"},{"blockId":42,"metric":"ALLOCATED_BYTES","reasons":["load-average-exceeds-maximum"],"workloadId":"lifecycle.no-script-one-step.v1"},{"blockId":43,"metric":"ALLOCATED_BYTES","reasons":["load-average-exceeds-maximum"],"workloadId":"lifecycle.no-script-one-step.v1"}],"schema":"revoman-benchmark-comparison/v1"}