{"campaignId":"smoke","compatibilityErrors":[],"metrics":[{"claimKind":"NON_REGRESSION","decision":"INCONCLUSIVE","gate":"WARM_MEDIAN","interval":{"lower95":0.9,"pointEstimate":0.95,"upper95":1.0},"limit":1.03,"metric":"LATENCY","mode":"WARM","reason":"smoke evidence cannot satisfy release gates","statistic":"MEDIAN"}],"overall":"INCONCLUSIVE","rejectedBlocks":[],"schema":"revoman-benchmark-comparison/v1"}