{"campaignId":"campaign-918f687c-a176-4c29-9aeb-ce24263874e0","compatibilityErrors":["target Gradle versions must match across roles","target build JDK JVM flags must match","target wrapper hashes must match across roles"],"metrics":[],"overall":"INCOMPATIBLE","rejectedBlocks":[],"schema":"revoman-benchmark-comparison/v1"}